"No.","Time","Length","Info"
"1","0.000000","200","Application Data"
"2","0.000000","86","443  >  56543 [SYN, ACK] Seq=0 Ack=1 Win=64800 Len=0 MSS=1440 SACK_PERM WS=1024"
"4","0.024264","189","Application Data"
"5","0.024374","74","56494  >  443 [ACK] Seq=1 Ack=242 Win=514 Len=0"
"11","0.064718","189","Application Data"
"16","0.099344","189","Application Data"
"17","0.099484","74","56494  >  443 [ACK] Seq=1 Ack=472 Win=513 Len=0"
"20","0.150769","189","Application Data"
"21","0.150769","363","Application Data"
"22","0.150873","74","56494  >  443 [ACK] Seq=1 Ack=876 Win=511 Len=0"
"31","0.240372","189","Application Data"
"32","0.240372","189","Application Data"
"33","0.240464","74","56494  >  443 [ACK] Seq=1 Ack=1106 Win=510 Len=0"
"34","0.269266","189","Application Data"
"38","0.309910","189","Application Data"
"39","0.310006","74","56494  >  443 [ACK] Seq=1 Ack=1336 Win=510 Len=0"
"51","0.349349","189","Application Data"
"52","0.350718","1394","Application Data"
"53","0.350994","74","56494  >  443 [ACK] Seq=1 Ack=2771 Win=515 Len=0"
"55","0.404634","189","Application Data"
"58","0.429907","189","Application Data"
"59","0.430059","74","56494  >  443 [ACK] Seq=1 Ack=3001 Win=514 Len=0"
"60","0.465795","189","Application Data"
"61","0.510219","189","Application Data"
"62","0.510341","74","56494  >  443 [ACK] Seq=1 Ack=3231 Win=513 Len=0"
"63","0.545461","189","Application Data"
"64","0.565522","363","Application Data"
"65","0.565693","74","56494  >  443 [ACK] Seq=1 Ack=3635 Win=511 Len=0"
"66","0.585045","189","Application Data"
"68","0.629804","189","Application Data"
"69","0.629974","74","56494  >  443 [ACK] Seq=1 Ack=3865 Win=511 Len=0"
"70","0.671354","189","Application Data"
"71","0.671354","99","Application Data"
"72","0.671529","74","56494  >  443 [ACK] Seq=1 Ack=4005 Win=510 Len=0"
"73","0.720316","1292","Initial, DCID=dab486865e459242, PKN: 1, CRYPTO"
"74","0.720509","1292","Initial, DCID=dab486865e459242, PKN: 2, PADDING, PING, PADDING, PING, CRYPTO, PING, CRYPTO, CRYPTO, PING, PING, PING, PADDING, CRYPTO, PING, PING, CRYPTO, CRYPTO, CRYPTO"
"75","0.725414","189","Application Data"
"76","0.760722","456","Application Data"
"77","0.760890","74","56494  >  443 [ACK] Seq=1 Ack=4502 Win=515 Len=0"
"78","0.795272","189","Application Data"
"79","0.795272","1292","Initial, SCID=fab486865e459242, PKN: 1, ACK, PADDING"
"80","0.795272","1292","Initial, SCID=fab486865e459242, PKN: 2, CRYPTO, PADDING"
"81","0.795272","1292","Initial, SCID=fab486865e459242, PKN: 3, CRYPTO, PADDING"
"82","0.796274","1292","Initial, DCID=fab486865e459242, PKN: 3, ACK, PADDING"
"83","0.810180","1292","Handshake, SCID=fab486865e459242"
"84","0.810180","1292","Handshake, SCID=fab486865e459242"
"85","0.810180","1292","Handshake, SCID=fab486865e459242"
"86","0.810961","101","Handshake, DCID=fab486865e459242"
"87","0.818100","102","Handshake, DCID=fab486865e459242"
"89","0.829875","189","Application Data"
"90","0.829974","74","56494  >  443 [ACK] Seq=1 Ack=4732 Win=514 Len=0"
"92","0.860392","294","Protected Payload (KP0)"
"93","0.861971","225","Protected Payload (KP0), DCID=fab486865e459242"
"94","0.862358","1288","Protected Payload (KP0), DCID=fab486865e459242"
"95","0.862416","418","Protected Payload (KP0), DCID=fab486865e459242"
"96","0.869914","189","Application Data"
"103","0.915068","189","Application Data"
"104","0.915419","74","56494  >  443 [ACK] Seq=1 Ack=4962 Win=513 Len=0"
"105","0.930119","1034","Protected Payload (KP0)"
"106","0.930119","183","Protected Payload (KP0)"
"107","0.930119","85","Protected Payload (KP0)"
"108","0.930119","89","Protected Payload (KP0)"
"109","0.931277","93","Protected Payload (KP0), DCID=fab486865e459242"
"110","0.955674","456","Application Data"
"111","0.957108","94","Protected Payload (KP0), DCID=fab486865e459242"
"115","0.969541","378","Application Data"
"116","0.969781","1514","56528  >  443 [ACK] Seq=305 Ack=1 Win=517 Len=1440 [TCP segment of a reassembled PDU]"
"117","0.969781","1514","56528  >  443 [ACK] Seq=1745 Ack=1 Win=517 Len=1440 [TCP segment of a reassembled PDU]"
"118","0.969781","1514","56528  >  443 [ACK] Seq=3185 Ack=1 Win=517 Len=1440 [TCP segment of a reassembled PDU]"
"119","0.969781","1493","Application Data"
"120","0.975713","323","Protected Payload (KP0)"
"121","0.975713","83","Protected Payload (KP0)"
"122","0.976482","97","Protected Payload (KP0), DCID=fab486865e459242"
"123","0.990324","189","Application Data"
"124","0.990450","74","56494  >  443 [ACK] Seq=1 Ack=5459 Win=511 Len=0"
"125","1.013677","94","Protected Payload (KP0), DCID=fab486865e459242"
"127","1.032006","189","Application Data"
"128","1.032006","74","443  >  56528 [ACK] Seq=1 Ack=305 Win=63 Len=0"
"129","1.032006","74","443  >  56528 [ACK] Seq=1 Ack=3185 Win=61 Len=0"
"130","1.055982","74","443  >  56528 [ACK] Seq=1 Ack=6044 Win=62 Len=0"
"131","1.055982","122","Application Data"
"132","1.055982","223","Application Data"
"133","1.056172","74","56528  >  443 [ACK] Seq=6044 Ack=198 Win=516 Len=0"
"134","1.065323","86","Protected Payload (KP0)"
"135","1.076160","74","56494  >  443 [ACK] Seq=1 Ack=5574 Win=511 Len=0"
"136","1.080939","189","Application Data"
"137","1.115649","189","Application Data"
"138","1.116004","74","56494  >  443 [ACK] Seq=1 Ack=5804 Win=510 Len=0"
"140","1.311743","456","Application Data"
"141","1.311743","189","Application Data"
"142","1.311743","230","Application Data"
"143","1.311743","204","Application Data"
"144","1.311743","204","Application Data"
"145","1.312014","74","56494  >  443 [ACK] Seq=1 Ack=6717 Win=515 Len=0"
"146","1.352595","193","Application Data"
"147","1.352687","74","56494  >  443 [ACK] Seq=1 Ack=6836 Win=514 Len=0"
"148","1.365387","1370","Application Data"
"150","1.390512","98","Application Data"
"151","1.391771","74","443  >  56492 [FIN, ACK] Seq=25 Ack=1 Win=63 Len=0"
"152","1.391771","189","Application Data"
"153","1.391890","74","56492  >  443 [ACK] Seq=1 Ack=26 Win=514 Len=0"
"154","1.391957","74","56494  >  443 [ACK] Seq=1 Ack=8247 Win=515 Len=0"
"155","1.405777","113","Application Data"
"156","1.405777","98","Application Data"
"159","1.405939","74","56480  >  443 [ACK] Seq=1 Ack=65 Win=517 Len=0"
"161","1.406335","74","56480  >  443 [FIN, ACK] Seq=1 Ack=65 Win=517 Len=0"
"179","1.430593","189","Application Data"
"181","1.460731","74","443  >  56480 [ACK] Seq=65 Ack=2 Win=63 Len=0"
"182","1.476306","189","Application Data"
"183","1.476399","74","56494  >  443 [ACK] Seq=1 Ack=8477 Win=514 Len=0"
"185","1.512408","189","Application Data"
"188","1.559600","456","Application Data"
"189","1.559717","74","56494  >  443 [ACK] Seq=1 Ack=8974 Win=512 Len=0"
"192","1.595293","189","Application Data"
"193","1.641254","189","Application Data"
"194","1.641388","74","56494  >  443 [ACK] Seq=1 Ack=9204 Win=511 Len=0"
"195","1.681777","189","Application Data"
"196","1.681777","99","Application Data"
"197","1.682220","74","56494  >  443 [ACK] Seq=1 Ack=9344 Win=511 Len=0"
"198","1.711719","189","Application Data"
"199","1.750845","189","Application Data"
"200","1.750943","74","56494  >  443 [ACK] Seq=1 Ack=9574 Win=510 Len=0"
"201","1.761076","113","Application Data"
"202","1.761076","363","Application Data"
"203","1.762453","74","56420  >  443 [FIN, ACK] Seq=1 Ack=40 Win=513 Len=0"
"204","1.791279","189","Application Data"
"205","1.791377","74","56494  >  443 [ACK] Seq=1 Ack=9978 Win=515 Len=0"
"206","1.811059","74","443  >  56420 [ACK] Seq=40 Ack=2 Win=36720 Len=0"
"207","1.811059","74","443  >  56420 [FIN, ACK] Seq=40 Ack=2 Win=36720 Len=0"
"208","1.811253","74","56420  >  443 [ACK] Seq=2 Ack=41 Win=513 Len=0"
"209","1.830841","189","Application Data"
"210","1.871710","189","Application Data"
"211","1.872015","74","56494  >  443 [ACK] Seq=1 Ack=10208 Win=514 Len=0"
"212","1.911875","189","Application Data"
"213","1.951415","189","Application Data"
"214","1.951506","74","56494  >  443 [ACK] Seq=1 Ack=10438 Win=513 Len=0"
"215","1.971434","363","Application Data"
"216","1.991941","189","Application Data"
"217","1.992007","74","56494  >  443 [ACK] Seq=1 Ack=10842 Win=511 Len=0"
"225","2.026708","189","Application Data"
"226","2.068544","74","56494  >  443 [ACK] Seq=1 Ack=10957 Win=511 Len=0"
"227","2.072185","189","Application Data"
"229","2.111346","189","Application Data"
"230","2.111436","74","56494  >  443 [ACK] Seq=1 Ack=11187 Win=510 Len=0"
"231","2.153341","189","Application Data"
"232","2.153341","113","Application Data"
"233","2.153341","98","Application Data"
"234","2.153341","74","443  >  56501 [FIN, ACK] Seq=64 Ack=1 Win=63 Len=0"
"235","2.153469","74","56501  >  443 [ACK] Seq=1 Ack=65 Win=517 Len=0"
"236","2.155157","74","56501  >  443 [FIN, ACK] Seq=1 Ack=65 Win=517 Len=0"
"237","2.166181","363","Application Data"
"240","2.166263","74","56494  >  443 [ACK] Seq=1 Ack=11591 Win=515 Len=0"
"243","2.192379","101","Application Data"
"244","2.192379","189","Application Data"
"245","2.192507","74","56494  >  443 [ACK] Seq=1 Ack=11733 Win=514 Len=0"
"246","2.194620","105","Application Data"
"247","2.221613","74","443  >  56501 [ACK] Seq=65 Ack=2 Win=63 Len=0"
"249","2.232061","189","Application Data"
"250","2.271472","189","Application Data"
"251","2.271594","74","56494  >  443 [ACK] Seq=32 Ack=11963 Win=513 Len=0"
"252","2.307943","189","Application Data"
"253","2.349417","74","56494  >  443 [ACK] Seq=32 Ack=12078 Win=513 Len=0"
"254","2.351560","189","Application Data"
"255","2.381897","1358","Application Data"
"256","2.382016","74","56494  >  443 [ACK] Seq=32 Ack=13477 Win=515 Len=0"
"257","2.393620","189","Application Data"
"258","2.432168","189","Application Data"
"259","2.432279","74","56494  >  443 [ACK] Seq=32 Ack=13707 Win=514 Len=0"
"260","2.472439","189","Application Data"
"261","2.472439","113","Application Data"
"262","2.472439","98","Application Data"
"263","2.472596","74","56495  >  443 [ACK] Seq=1 Ack=65 Win=517 Len=0"
"264","2.473869","74","56495  >  443 [FIN, ACK] Seq=1 Ack=65 Win=517 Len=0"
"265","2.512193","189","Application Data"
"266","2.512303","74","56494  >  443 [ACK] Seq=32 Ack=13937 Win=513 Len=0"
"267","2.531994","74","443  >  56495 [ACK] Seq=65 Ack=2 Win=63 Len=0"
"268","2.552567","189","Application Data"
"269","2.563008","363","Application Data"
"270","2.563109","74","56494  >  443 [ACK] Seq=32 Ack=14341 Win=511 Len=0"
"271","2.597303","189","Application Data"
"272","2.626737","189","Application Data"
"273","2.626845","74","56494  >  443 [ACK] Seq=32 Ack=14571 Win=511 Len=0"
"281","2.676860","189","Application Data"
"282","2.692508","99","Application Data"
"283","2.692683","74","56494  >  443 [ACK] Seq=32 Ack=14711 Win=510 Len=0"
"284","2.712747","178","Application Data"
"286","2.742615","113","Application Data"
"287","2.742615","98","Application Data"
"288","2.742615","174","Application Data"
"289","2.742721","74","56513  >  443 [ACK] Seq=1 Ack=65 Win=517 Len=0"
"290","2.742767","74","56494  >  443 [ACK] Seq=32 Ack=14915 Win=515 Len=0"
"291","2.743557","74","56513  >  443 [FIN, ACK] Seq=1 Ack=65 Win=517 Len=0"
"292","2.762305","363","Application Data"
"293","2.792323","174","Application Data"
"294","2.792323","74","443  >  56513 [ACK] Seq=65 Ack=2 Win=63 Len=0"
"295","2.792480","74","56494  >  443 [ACK] Seq=32 Ack=15304 Win=513 Len=0"
"296","2.831876","174","Application Data"
"297","2.880409","74","56494  >  443 [ACK] Seq=32 Ack=15404 Win=513 Len=0"
"298","2.882950","174","Application Data"
"299","2.913190","174","Application Data"
"300","2.913319","74","56494  >  443 [ACK] Seq=32 Ack=15604 Win=512 Len=0"
"301","2.952473","174","Application Data"
"302","2.962990","363","Application Data"
"303","2.963148","74","56494  >  443 [ACK] Seq=32 Ack=15993 Win=511 Len=0"
"304","2.992247","174","Application Data"
"305","3.037845","74","56494  >  443 [ACK] Seq=32 Ack=16093 Win=510 Len=0"
"306","3.037878","174","Application Data"
"307","3.073367","174","Application Data"
"308","3.073475","74","56494  >  443 [ACK] Seq=32 Ack=16293 Win=515 Len=0"
"309","3.114103","174","Application Data"
"313","3.152716","174","Application Data"
"314","3.153143","74","56494  >  443 [ACK] Seq=32 Ack=16493 Win=514 Len=0"
"315","3.172485","363","Application Data"
"316","3.188953","174","Application Data"
"317","3.189044","74","56494  >  443 [ACK] Seq=32 Ack=16882 Win=513 Len=0"
"318","3.238745","174","Application Data"
"319","3.272429","174","Application Data"
"320","3.272533","74","56494  >  443 [ACK] Seq=32 Ack=17082 Win=512 Len=0"
"321","3.314295","174","Application Data"
"322","3.363731","174","Application Data"
"323","3.363731","1103","Application Data"
"324","3.363731","363","Application Data"
"325","3.363871","74","56494  >  443 [ACK] Seq=32 Ack=18600 Win=515 Len=0"
"326","3.392464","174","Application Data"
"327","3.402670","113","Application Data"
"328","3.402670","98","Application Data"
"331","3.402885","74","56542  >  443 [ACK] Seq=1 Ack=65 Win=517 Len=0"
"333","3.403995","74","56542  >  443 [FIN, ACK] Seq=1 Ack=65 Win=517 Len=0"
"334","3.427820","174","Application Data"
"335","3.427973","74","56494  >  443 [ACK] Seq=32 Ack=18800 Win=514 Len=0"
"336","3.463657","74","443  >  56542 [ACK] Seq=65 Ack=2 Win=63 Len=0"
"337","3.472806","98","Application Data"
"338","3.474113","74","443  >  56549 [FIN, ACK] Seq=25 Ack=1 Win=63 Len=0"
"339","3.474113","163","Application Data"
"340","3.474266","74","56549  >  443 [ACK] Seq=1 Ack=26 Win=514 Len=0"
"341","3.508479","159","Application Data"
"342","3.508616","74","56494  >  443 [ACK] Seq=32 Ack=18974 Win=513 Len=0"
"343","3.547677","159","Application Data"
"344","3.563541","363","Application Data"
"345","3.563667","74","56494  >  443 [ACK] Seq=32 Ack=19348 Win=512 Len=0"
"346","3.588295","159","Application Data"
"347","3.628572","159","Application Data"
"348","3.628730","74","56494  >  443 [ACK] Seq=32 Ack=19518 Win=511 Len=0"
"349","3.668807","159","Application Data"
"350","3.688350","99","Application Data"
"351","3.688452","74","56494  >  443 [ACK] Seq=32 Ack=19628 Win=511 Len=0"
"352","3.728055","159","Application Data"
"353","3.753398","159","Application Data"
"354","3.753622","74","56494  >  443 [ACK] Seq=32 Ack=19798 Win=510 Len=0"
"355","3.768274","363","Application Data"
"356","3.788919","159","Application Data"
"357","3.789051","74","56494  >  443 [ACK] Seq=32 Ack=20172 Win=515 Len=0"
"358","3.833772","159","Application Data"
"359","3.868563","159","Application Data"
"360","3.868736","74","56494  >  443 [ACK] Seq=32 Ack=20342 Win=514 Len=0"
"361","3.908612","159","Application Data"
"362","3.948136","159","Application Data"
"363","3.948228","74","56494  >  443 [ACK] Seq=32 Ack=20512 Win=513 Len=0"
"364","3.984617","363","Application Data"
"365","3.984617","159","Application Data"
"366","3.984818","74","56494  >  443 [ACK] Seq=32 Ack=20886 Win=512 Len=0"
"367","4.033450","159","Application Data"
"368","4.073929","159","Application Data"
"369","4.074049","74","56494  >  443 [ACK] Seq=32 Ack=21056 Win=511 Len=0"
"370","4.113702","159","Application Data"
"371","4.158498","159","Application Data"
"372","4.158498","363","Application Data"
"373","4.158645","74","56494  >  443 [ACK] Seq=32 Ack=21515 Win=510 Len=0"
"375","4.199636","159","Application Data"
"376","4.228873","159","Application Data"
"377","4.228873","113","Application Data"
"378","4.228873","98","Application Data"
"379","4.229100","74","56494  >  443 [ACK] Seq=32 Ack=21685 Win=515 Len=0"
"380","4.229186","74","56563  >  443 [ACK] Seq=1 Ack=65 Win=513 Len=0"
"381","4.230050","74","56563  >  443 [FIN, ACK] Seq=1 Ack=65 Win=513 Len=0"
"382","4.268632","159","Application Data"
"383","4.288388","74","443  >  56563 [ACK] Seq=65 Ack=2 Win=63 Len=0"
"384","4.309143","159","Application Data"
"385","4.309314","74","56494  >  443 [ACK] Seq=32 Ack=21855 Win=514 Len=0"
"389","4.348376","159","Application Data"
"390","4.384892","1310","Application Data"
"391","4.384892","196","Application Data"
"392","4.385017","74","56494  >  443 [ACK] Seq=32 Ack=23298 Win=515 Len=0"
"396","4.424582","174","Application Data"
"429","4.479842","74","56494  >  443 [ACK] Seq=32 Ack=23398 Win=514 Len=0"
"432","4.483704","174","Application Data"
"436","4.526277","74","56494  >  443 [ACK] Seq=32 Ack=23498 Win=514 Len=0"
"437","4.794653","174","Application Data"
"438","4.794653","174","Application Data"
"439","4.794653","363","Application Data"
"440","4.794653","174","Application Data"
"441","4.794653","174","Application Data"
"442","4.794653","174","Application Data"
"443","4.794653","99","Application Data"
"444","4.794653","174","Application Data"
"445","4.794653","171","Application Data"
"446","4.794653","363","Application Data"
"447","4.794653","363","[TCP Retransmission] 443  >  56494 [PSH, ACK] Seq=24509 Ack=32 Win=8 Len=289"
"448","4.794936","86","56494  >  443 [ACK] Seq=32 Ack=24798 Win=515 Len=0 SLE=24509 SRE=24798"
"449","4.809094","159","Application Data"
"450","4.829233","159","Application Data"
"451","4.829569","74","56494  >  443 [ACK] Seq=32 Ack=24968 Win=514 Len=0"
"452","4.879146","159","Application Data"
"453","4.909923","159","Application Data"
"454","4.910067","74","56494  >  443 [ACK] Seq=32 Ack=25138 Win=513 Len=0"
"455","4.960420","159","Application Data"
"457","4.974499","363","Application Data"
"458","4.974584","74","56494  >  443 [ACK] Seq=32 Ack=25512 Win=512 Len=0"
"459","5.054190","159","Application Data"
"460","5.054190","86","443  >  56484 [SYN, ACK] Seq=0 Ack=1 Win=65535 Len=0 MSS=1440 SACK_PERM WS=256"
"461","5.054190","86","443  >  56487 [SYN, ACK] Seq=0 Ack=1 Win=65535 Len=0 MSS=1440 SACK_PERM WS=256"
"462","5.054190","159","Application Data"
"463","5.054415","74","56494  >  443 [ACK] Seq=32 Ack=25682 Win=511 Len=0"
"464","5.069793","159","Application Data"
"465","5.114359","159","Application Data"
"466","5.114482","74","56494  >  443 [ACK] Seq=32 Ack=25852 Win=511 Len=0"
"467","5.159160","159","Application Data"
"468","5.169523","363","Application Data"
"469","5.169630","74","56494  >  443 [ACK] Seq=32 Ack=26226 Win=515 Len=0"
"470","5.189473","159","Application Data"
"471","5.230101","159","Application Data"
"472","5.230189","74","56494  >  443 [ACK] Seq=32 Ack=26396 Win=514 Len=0"
"473","5.270038","159","Application Data"
"474","5.305005","86","443  >  56486 [SYN, ACK] Seq=0 Ack=1 Win=65535 Len=0 MSS=1440 SACK_PERM WS=256"
"475","5.305005","159","Application Data"
"476","5.305163","74","56494  >  443 [ACK] Seq=32 Ack=26566 Win=513 Len=0"
"477","5.349462","159","Application Data"
"478","5.365280","995","Application Data"
"479","5.365382","74","56494  >  443 [ACK] Seq=32 Ack=27572 Win=510 Len=0"
"480","5.374629","363","Application Data"
"481","5.391255","159","Application Data"
"482","5.391340","74","56494  >  443 [ACK] Seq=32 Ack=27946 Win=515 Len=0"
"483","5.431358","159","Application Data"
"484","5.471468","159","Application Data"
"485","5.471468","113","Application Data"
"486","5.471574","74","56494  >  443 [ACK] Seq=32 Ack=28116 Win=514 Len=0"
"487","5.472114","74","56582  >  443 [FIN, ACK] Seq=1 Ack=40 Win=513 Len=0"
"488","5.480613","98","Application Data"
"489","5.480740","74","56582  >  443 [RST, ACK] Seq=2 Ack=64 Win=0 Len=0"
"490","5.495215","86","443  >  56483 [SYN, ACK] Seq=0 Ack=1 Win=65535 Len=0 MSS=1440 SACK_PERM WS=256"
"491","5.510115","159","Application Data"
"492","5.524882","74","443  >  56582 [ACK] Seq=65 Ack=2 Win=63 Len=0"
"493","5.549870","159","Application Data"
"494","5.549988","74","56494  >  443 [ACK] Seq=32 Ack=28286 Win=513 Len=0"
"495","5.565389","363","Application Data"
"496","5.590877","159","Application Data"
"500","5.591001","74","56494  >  443 [ACK] Seq=32 Ack=28660 Win=512 Len=0"
"503","5.630149","159","Application Data"
"504","5.670417","74","56494  >  443 [ACK] Seq=32 Ack=28745 Win=512 Len=0"
"506","5.685163","159","Application Data"
"507","5.695723","99","Application Data"
"508","5.696072","74","56494  >  443 [ACK] Seq=32 Ack=28855 Win=511 Len=0"
"509","5.710525","159","Application Data"
"513","5.761199","159","Application Data"
"514","5.761329","74","56494  >  443 [ACK] Seq=32 Ack=29025 Win=511 Len=0"
"515","5.770076","363","Application Data"
"516","5.790102","159","Application Data"
"517","5.790192","74","56494  >  443 [ACK] Seq=32 Ack=29399 Win=515 Len=0"
"518","5.830704","159","Application Data"
"519","5.873220","74","56494  >  443 [ACK] Seq=32 Ack=29484 Win=514 Len=0"
"522","5.919303","222","Application Data"
"528","5.955802","159","Application Data"
"529","5.955891","74","56494  >  443 [ACK] Seq=32 Ack=29717 Win=514 Len=0"
"530","5.973345","363","Application Data"
"531","5.991334","159","Application Data"
"532","5.991440","74","56494  >  443 [ACK] Seq=32 Ack=30091 Win=512 Len=0"
"533","6.030705","159","Application Data"
"534","6.070919","159","Application Data"
"535","6.071056","74","56494  >  443 [ACK] Seq=32 Ack=30261 Win=511 Len=0"
"536","6.113922","159","Application Data"
"537","6.151468","159","Application Data"
"538","6.151605","74","56494  >  443 [ACK] Seq=32 Ack=30431 Win=511 Len=0"
"539","6.173072","363","Application Data"
"540","6.190823","159","Application Data"
"541","6.190909","74","56494  >  443 [ACK] Seq=32 Ack=30805 Win=515 Len=0"
"542","6.240904","159","Application Data"
"544","6.273129","159","Application Data"
"545","6.273254","74","56494  >  443 [ACK] Seq=32 Ack=30975 Win=514 Len=0"
"546","6.310819","159","Application Data"
"547","6.352448","159","Application Data"
"548","6.352548","74","56494  >  443 [ACK] Seq=32 Ack=31145 Win=513 Len=0"
"549","6.371371","1007","Application Data"
"550","6.371371","363","Application Data"
"551","6.371461","74","56494  >  443 [ACK] Seq=32 Ack=32367 Win=515 Len=0"
"552","6.396307","159","Application Data"
"553","6.435168","159","Application Data"
"554","6.435356","74","56494  >  443 [ACK] Seq=32 Ack=32537 Win=514 Len=0"
"555","6.471476","159","Application Data"
"560","6.500710","114","Application Data"
"561","6.511054","159","Application Data"
"562","6.551331","159","Application Data"
"563","6.552207","74","56494  >  443 [ACK] Seq=72 Ack=32792 Win=513 Len=0"
"564","6.575975","363","Application Data"
"565","6.600949","159","Application Data"
"566","6.601075","74","56494  >  443 [ACK] Seq=72 Ack=33166 Win=512 Len=0"
"567","6.631970","159","Application Data"
"568","6.647867","1292","Initial, DCID=7522ec029197de40, PKN: 1, CRYPTO"
"569","6.648068","1292","Initial, DCID=7522ec029197de40, PKN: 2, PADDING, PING, PING, PADDING, CRYPTO, PADDING, PING, PADDING, PING"
"570","6.649979","388","Application Data"
"571","6.650164","113","Application Data"
"572","6.650637","389","64507  >  443 Len=327"
"573","6.651058","377","Application Data"
"574","6.651151","153","Application Data"
"575","6.655032","145","Application Data"
"576","6.655107","74","56494  >  443 [ACK] Seq=72 Ack=33322 Win=511 Len=0"
"577","6.656643","697","60223  >  443 Len=635"
"581","6.671600","1229","Application Data"
"582","6.696407","74","443  >  56374 [ACK] Seq=1 Ack=315 Win=292 Len=0"
"583","6.696407","74","443  >  56374 [ACK] Seq=1 Ack=354 Win=292 Len=0"
"584","6.696407","126","Application Data"
"585","6.696407","1294","Initial, SCID=8d1d012336ed81f2, PKN: 13536604, CRYPTO, ACK, PADDING"
"586","6.696407","1294","Handshake, SCID=8d1d012336ed81f2"
"587","6.696407","1294","Handshake, SCID=8d1d012336ed81f2"
"588","6.696690","137","Handshake, SCID=8d1d012336ed81f2"
"589","6.696690","142","Protected Payload (KP0)"
"590","6.696690","89","443  >  64507 Len=27"
"591","6.698210","1292","Handshake, DCID=8d1d012336ed81f2"
"592","6.698628","215","Protected Payload (KP0), DCID=8d1d012336ed81f2"
"593","6.706733","99","Application Data"
"594","6.706733","74","443  >  56528 [ACK] Seq=198 Ack=6426 Win=63 Len=0"
"595","6.706733","122","Application Data"
"596","6.706733","223","Application Data"
"597","6.706938","74","56494  >  443 [ACK] Seq=72 Ack=34502 Win=515 Len=0"
"598","6.707015","74","56528  >  443 [ACK] Seq=6426 Ack=395 Win=515 Len=0"
"599","6.716187","89","443  >  60223 Len=27"
"600","6.716187","129","Application Data"
"602","6.732809","97","Protected Payload (KP0), DCID=8d1d012336ed81f2"
"603","6.732952","95","64507  >  443 Len=33"
"608","6.736312","101","Handshake, SCID=8d1d012336ed81f2"
"609","6.736312","174","Protected Payload (KP0)"
"610","6.736312","334","Protected Payload (KP0)"
"612","6.736834","96","Protected Payload (KP0), DCID=8d1d012336ed81f2"
"616","6.739044","74","56492  >  443 [FIN, ACK] Seq=1 Ack=26 Win=514 Len=0"
"622","6.740800","74","56549  >  443 [FIN, ACK] Seq=1 Ack=26 Win=514 Len=0"
"634","6.743455","94","60223  >  443 Len=32"
"635","6.748827","74","56374  >  443 [ACK] Seq=354 Ack=53 Win=516 Len=0"
"636","6.751811","129","Application Data"
"637","6.751811","175","443  >  60223 Len=113"
"638","6.751972","74","56494  >  443 [ACK] Seq=72 Ack=34612 Win=514 Len=0"
"639","6.752592","97","60223  >  443 Len=35"
"640","6.758007","92","60223  >  443 Len=30"
"641","6.758175","97","60223  >  443 Len=35"
"642","6.761391","84","443  >  60223 Len=22"
"643","6.761391","1239","443  >  64507 Len=1177"
"644","6.761998","98","64507  >  443 Len=36"
"645","6.770814","88","443  >  64507 Len=26"
"646","6.770814","98","443  >  64507 Len=36"
"647","6.770814","363","Application Data"
"648","6.771603","94","64507  >  443 Len=32"
"649","6.789386","94","60223  >  443 Len=32"
"650","6.791725","74","443  >  56492 [ACK] Seq=26 Ack=2 Win=63 Len=0"
"653","6.791725","129","Application Data"
"654","6.791725","74","443  >  56549 [ACK] Seq=26 Ack=2 Win=63 Len=0"
"655","6.791951","74","56494  >  443 [ACK] Seq=72 Ack=34956 Win=513 Len=0"
"657","6.801050","1466","443  >  56374 [ACK] Seq=53 Ack=354 Win=292 Len=1392 [TCP segment of a reassembled PDU]"
"658","6.801050","1466","Application Data"
"660","6.801434","74","56374  >  443 [ACK] Seq=354 Ack=2837 Win=516 Len=0"
"663","6.811572","1466","Application Data"
"664","6.811572","240","Application Data"
"665","6.811572","1466","443  >  56374 [ACK] Seq=4395 Ack=354 Win=292 Len=1392 [TCP segment of a reassembled PDU]"
"666","6.811572","1466","Application Data"
"667","6.811572","85","443  >  60223 Len=23"
"668","6.811793","74","56374  >  443 [ACK] Seq=354 Ack=7179 Win=516 Len=0"
"669","6.824981","109","Application Data"
"670","6.831112","1466","Application Data"
"671","6.831112","1466","Application Data"
"672","6.831112","87","443  >  64507 Len=25"
"673","6.831112","1466","Application Data"
"674","6.831302","74","56374  >  443 [ACK] Seq=389 Ack=9963 Win=516 Len=0"
"675","6.831508","74","56374  >  443 [ACK] Seq=389 Ack=11355 Win=516 Len=0"
"676","6.832510","980","Application Data, Application Data"
"677","6.832510","129","Application Data"
"678","6.832678","74","56374  >  443 [ACK] Seq=389 Ack=12261 Win=513 Len=0"
"679","6.842006","86","443  >  60223 Len=24"
"687","6.873140","74","56494  >  443 [ACK] Seq=72 Ack=35011 Win=513 Len=0"
"693","6.878071","129","Application Data"
"697","6.886724","138","Application Data"
"698","6.886859","74","56494  >  443 [ACK] Seq=72 Ack=35130 Win=512 Len=0"
"700","6.912859","74","443  >  56374 [ACK] Seq=12261 Ack=389 Win=292 Len=0"
"701","6.912859","129","Application Data"
"710","6.951616","129","Application Data"
"712","6.952201","74","56494  >  443 [ACK] Seq=72 Ack=35240 Win=512 Len=0"
"716","6.966313","363","Application Data"
"717","6.991805","129","Application Data"
"718","6.991954","74","56494  >  443 [ACK] Seq=72 Ack=35584 Win=511 Len=0"
"720","7.031436","129","Application Data"
"722","7.074146","74","56494  >  443 [ACK] Seq=72 Ack=35639 Win=510 Len=0"
"723","7.076374","129","Application Data"
"725","7.112746","129","Application Data"
"726","7.112879","74","56494  >  443 [ACK] Seq=72 Ack=35749 Win=510 Len=0"
"727","7.128192","138","Application Data"
"728","7.151904","129","Application Data"
"731","7.152017","74","56494  >  443 [ACK] Seq=72 Ack=35868 Win=515 Len=0"
"738","7.172051","363","Application Data"
"740","7.191333","129","Application Data"
"741","7.191509","74","56494  >  443 [ACK] Seq=72 Ack=36212 Win=513 Len=0"
"744","7.232370","129","Application Data"
"749","7.241275","115","Application Data"
"751","7.246498","1292","Initial, DCID=026b62d13924bf92, PKN: 1, CRYPTO"
"752","7.246668","1292","Initial, DCID=026b62d13924bf92, PKN: 2, CRYPTO"
"753","7.246761","1292","Initial, DCID=026b62d13924bf92, PKN: 3, PING, PING, PING, PING, CRYPTO, CRYPTO, PADDING, PING, PING, PING, PING, PADDING, PING, PADDING"
"754","7.247174","141","0-RTT, DCID=026b62d13924bf92"
"756","7.272429","129","Application Data"
"757","7.280451","115","Application Data"
"759","7.302350","1292","Initial, SCID=e26b62d13924bf92, PKN: 1, ACK, PADDING"
"760","7.302350","1292","Initial, SCID=e26b62d13924bf92, PKN: 2, ACK, PADDING"
"761","7.304471","115","Application Data"
"762","7.306372","219","64507  >  443 Len=157"
"763","7.311545","129","Application Data"
"772","7.316298","1292","Initial, DCID=e26b62d13924bf92, PKN: 6, PADDING, PING, PADDING"
"774","7.329378","115","Application Data"
"786","7.346596","115","Application Data"
"787","7.363039","115","Application Data"
"799","7.377303","74","443  >  56494 [ACK] Seq=36377 Ack=195 Win=8 Len=0"
"800","7.377303","1292","Initial, SCID=e26b62d13924bf92, PKN: 3, CRYPTO, PADDING"
"801","7.377303","358","Protected Payload (KP0)"
"802","7.377303","996","Protected Payload (KP0)"
"803","7.377303","127","Protected Payload (KP0)"
"804","7.377303","86","Protected Payload (KP0)"
"805","7.377303","90","443  >  64507 Len=28"
"806","7.377303","175","Application Data"
"807","7.377303","138","Application Data"
"808","7.377303","1008","Application Data"
"809","7.377303","363","Application Data"
"811","7.378122","74","56494  >  443 [ACK] Seq=318 Ack=37765 Win=515 Len=0"
"812","7.380236","1292","Handshake, DCID=e26b62d13924bf92"
"813","7.380628","93","Protected Payload (KP0), DCID=e26b62d13924bf92"
"814","7.381383","115","Application Data"
"815","7.383080","862","Protected Payload (KP0), DCID=e26b62d13924bf92"
"816","7.386873","1292","Initial, SCID=e26b62d13924bf92, PKN: 9, ACK, CRYPTO"
"820","7.386873","144","Application Data"
"827","7.398328","115","Application Data"
"828","7.414813","95","64507  >  443 Len=33"
"829","7.422254","824","443  >  64507 Len=762"
"830","7.422254","88","443  >  64507 Len=26"
"831","7.422254","106","443  >  64507 Len=44"
"832","7.422254","74","443  >  56494 [ACK] Seq=37835 Ack=318 Win=8 Len=0"
"833","7.422825","98","64507  >  443 Len=36"
"834","7.422924","94","64507  >  443 Len=32"
"835","7.429095","115","Application Data"
"836","7.433582","144","Application Data"
"837","7.444856","182","Protected Payload (KP0)"
"838","7.444856","91","Protected Payload (KP0)"
"840","7.445772","96","Protected Payload (KP0), DCID=e26b62d13924bf92"
"841","7.447094","95","Protected Payload (KP0), DCID=e26b62d13924bf92"
"842","7.447578","115","Application Data"
"843","7.461860","115","Application Data"
"844","7.470361","74","443  >  56494 [ACK] Seq=37905 Ack=441 Win=8 Len=0"
"845","7.470361","163","Application Data"
"846","7.470361","86","443  >  56509 [SYN, ACK] Seq=0 Ack=1 Win=64800 Len=0 MSS=1440 SACK_PERM WS=1024"
"847","7.478607","115","Application Data"
"848","7.492264","232","Protected Payload (KP0)"
"849","7.492264","83","Protected Payload (KP0)"
"850","7.492264","87","443  >  64507 Len=25"
"851","7.492558","99","Protected Payload (KP0), DCID=e26b62d13924bf92"
"852","7.492644","95","Protected Payload (KP0), DCID=e26b62d13924bf92"
"853","7.508738","74","443  >  56494 [ACK] Seq=37994 Ack=523 Win=8 Len=0"
"854","7.508738","163","Application Data"
"855","7.511732","115","Application Data"
"856","7.528353","115","Application Data"
"857","7.545325","115","Application Data"
"858","7.564104","115","Application Data"
"859","7.567413","144","Application Data"
"860","7.567413","86","Protected Payload (KP0)"
"861","7.567413","363","Application Data"
"862","7.567551","74","56494  >  443 [ACK] Seq=728 Ack=38442 Win=512 Len=0"
"863","7.579357","115","Application Data"
"864","7.581892","74","443  >  56494 [ACK] Seq=38442 Ack=687 Win=8 Len=0"
"865","7.595332","115","Application Data"
"866","7.601540","163","Application Data"
"867","7.601540","138","Application Data"
"868","7.601626","74","56494  >  443 [ACK] Seq=810 Ack=38595 Win=512 Len=0"
"869","7.612826","115","Application Data"
"870","7.628901","115","Application Data"
"871","7.637148","74","443  >  56494 [ACK] Seq=38595 Ack=810 Win=8 Len=0"
"872","7.646243","115","Application Data"
"873","7.647581","160","Application Data"
"874","7.664342","115","Application Data"
"875","7.667572","74","443  >  56494 [ACK] Seq=38681 Ack=892 Win=8 Len=0"
"876","7.689692","177","Application Data"
"879","7.689692","99","Application Data"
"883","7.689848","74","56494  >  443 [ACK] Seq=974 Ack=38809 Win=511 Len=0"
"888","7.696210","115","Application Data"
"889","7.712389","115","Application Data"
"890","7.727662","144","Application Data"
"891","7.731003","115","Application Data"
"892","7.747846","115","Application Data"
"893","7.752947","74","443  >  56494 [ACK] Seq=38879 Ack=1056 Win=8 Len=0"
"896","7.763315","164","Application Data"
"899","7.764511","115","Application Data"
"900","7.773774","363","Application Data"
"902","7.773902","74","56494  >  443 [ACK] Seq=1179 Ack=39258 Win=515 Len=0"
"903","7.780589","115","Application Data"
"904","7.797994","74","443  >  56494 [ACK] Seq=39258 Ack=1138 Win=8 Len=0"
"905","7.798351","115","Application Data"
"907","7.807468","195","Application Data"
"908","7.813604","115","Application Data"
"909","7.816820","74","443  >  56494 [ACK] Seq=39379 Ack=1220 Win=8 Len=0"
"910","7.829595","115","Application Data"
"911","7.847586","115","Application Data"
"912","7.853634","163","Application Data"
"913","7.853634","138","Application Data"
"914","7.853634","113","Application Data"
"915","7.853634","98","Application Data"
"916","7.853634","74","443  >  56617 [FIN, ACK] Seq=64 Ack=1 Win=63 Len=0"
"917","7.853801","74","56494  >  443 [ACK] Seq=1384 Ack=39532 Win=514 Len=0"
"918","7.853869","74","56617  >  443 [ACK] Seq=1 Ack=65 Win=513 Len=0"
"919","7.854198","74","56617  >  443 [FIN, ACK] Seq=1 Ack=65 Win=513 Len=0"
"920","7.864034","115","Application Data"
"921","7.868186","74","443  >  56494 [ACK] Seq=39532 Ack=1343 Win=8 Len=0"
"922","7.880141","115","Application Data"
"923","7.896869","115","Application Data"
"924","7.897942","144","Application Data"
"926","7.914032","115","Application Data"
"927","7.930632","115","Application Data"
"928","7.937085","74","443  >  56617 [ACK] Seq=65 Ack=2 Win=63 Len=0"
"929","7.937085","74","443  >  56494 [ACK] Seq=39602 Ack=1466 Win=8 Len=0"
"930","7.947127","115","Application Data"
"931","7.947456","163","Application Data"
"932","7.947456","74","443  >  56494 [ACK] Seq=39691 Ack=1548 Win=8 Len=0"
"933","7.964752","115","Application Data"
"934","7.973520","180","Application Data"
"935","7.973520","363","Application Data"
"936","7.973520","86","443  >  56541 [SYN, ACK] Seq=0 Ack=1 Win=64800 Len=0 MSS=1440 SACK_PERM WS=1024"
"937","7.973641","74","56494  >  443 [ACK] Seq=1671 Ack=40086 Win=512 Len=0"
"938","7.980290","115","Application Data"
"939","7.997005","115","Application Data"
"940","8.002962","144","Application Data"
"942","8.013603","115","Application Data"
"943","8.027142","74","443  >  56494 [ACK] Seq=40156 Ack=1712 Win=8 Len=0"
"944","8.031027","115","Application Data"
"945","8.037539","113","Application Data"
"946","8.037539","98","Application Data"
"947","8.037539","74","443  >  56618 [FIN, ACK] Seq=64 Ack=1 Win=63 Len=0"
"948","8.037539","144","Application Data"
"949","8.037722","74","56618  >  443 [ACK] Seq=1 Ack=65 Win=517 Len=0"
"950","8.038391","74","56618  >  443 [FIN, ACK] Seq=1 Ack=65 Win=517 Len=0"
"951","8.047545","115","Application Data"
"953","8.063737","115","Application Data"
"954","8.067842","74","443  >  56494 [ACK] Seq=40226 Ack=1835 Win=8 Len=0"
"955","8.080853","115","Application Data"
"956","8.103216","221","Application Data"
"957","8.103216","74","443  >  56618 [ACK] Seq=65 Ack=2 Win=63 Len=0"
"958","8.113475","115","Application Data"
"959","8.122858","74","443  >  56494 [ACK] Seq=40373 Ack=1958 Win=8 Len=0"
"960","8.122858","144","Application Data"
"961","8.129529","115","Application Data"
"962","8.146166","115","Application Data"
"963","8.163481","115","Application Data"
"964","8.168546","167","Application Data"
"965","8.179117","115","Application Data"
"966","8.185327","363","Application Data"
"967","8.185417","74","56494  >  443 [ACK] Seq=2163 Ack=40825 Win=515 Len=0"
"968","8.195827","115","Application Data"
"969","8.206624","74","443  >  56494 [ACK] Seq=40825 Ack=2081 Win=8 Len=0"
"970","8.206624","144","Application Data"
"971","8.212683","115","Application Data"
"972","8.228684","115","Application Data"
"973","8.237781","74","443  >  56494 [ACK] Seq=40895 Ack=2204 Win=8 Len=0"
"974","8.237781","144","Application Data"
"975","8.247691","115","Application Data"
"976","8.263993","115","Application Data"
"977","8.267857","74","443  >  56494 [ACK] Seq=40965 Ack=2286 Win=8 Len=0"
"978","8.280166","115","Application Data"
"979","8.287573","148","Application Data"
"980","8.296775","115","Application Data"
"981","8.307727","74","443  >  56494 [ACK] Seq=41039 Ack=2368 Win=8 Len=0"
"982","8.307727","86","[TCP Retransmission] 443  >  56543 [SYN, ACK] Seq=0 Ack=1 Win=64800 Len=0 MSS=1440 SACK_PERM WS=1024"
"983","8.313961","115","Application Data"
"984","8.323025","144","Application Data"
"985","8.323025","138","Application Data"
"986","8.323114","74","56494  >  443 [ACK] Seq=2491 Ack=41173 Win=513 Len=0"
"987","8.331514","115","Application Data"
"988","8.347643","115","Application Data"
"990","8.358383","74","443  >  56494 [ACK] Seq=41173 Ack=2491 Win=8 Len=0"
"991","8.363930","115","Application Data"
"992","8.372955","1093","Application Data"
"993","8.372955","363","Application Data"
"994","8.373054","74","56494  >  443 [ACK] Seq=2614 Ack=42481 Win=515 Len=0"
"995","8.379928","115","Application Data"
"996","8.396681","115","Application Data"
"997","8.402981","213","Application Data"
"998","8.415056","115","Application Data"
"999","8.423577","74","443  >  56494 [ACK] Seq=42620 Ack=2655 Win=8 Len=0"
"1001","8.446488","115","Application Data"
"1002","8.449297","221","Application Data"
"1005","8.463106","115","Application Data"
"1006","8.481325","115","Application Data"
"1007","8.485020","74","443  >  56494 [ACK] Seq=42767 Ack=2778 Win=8 Len=0"
"1008","8.485020","182","Application Data"
"1009","8.496290","115","Application Data"
"1011","8.512867","115","Application Data"
"1012","8.519376","74","443  >  56494 [ACK] Seq=42875 Ack=2860 Win=8 Len=0"
"1013","8.519376","188","Application Data"
"1014","8.529418","115","Application Data"
"1015","8.546182","115","Application Data"
"1016","8.552800","74","443  >  56494 [ACK] Seq=42989 Ack=2942 Win=8 Len=0"
"1017","8.565087","115","Application Data"
"1018","8.565376","185","Application Data"
"1019","8.565376","405","Application Data"
"1020","8.565453","74","56494  >  443 [ACK] Seq=3065 Ack=43431 Win=511 Len=0"
"1021","8.596908","115","Application Data"
"1022","8.603312","150","Application Data"
"1023","8.613185","115","Application Data"
"1024","8.629920","115","Application Data"
"1025","8.638959","74","443  >  56494 [ACK] Seq=43507 Ack=3106 Win=7 Len=0"
"1026","8.638959","148","Application Data"
"1027","8.645854","115","Application Data"
"1028","8.663360","115","Application Data"
"1029","8.668058","74","443  >  56494 [ACK] Seq=43581 Ack=3188 Win=8 Len=0"
"1030","8.680958","115","Application Data"
"1031","8.684164","167","Application Data"
"1032","8.684164","99","Application Data"
"1033","8.684295","74","56494  >  443 [ACK] Seq=3311 Ack=43699 Win=510 Len=0"
"1034","8.697170","115","Application Data"
"1035","8.713757","115","Application Data"
"1036","8.718951","74","443  >  56494 [ACK] Seq=43699 Ack=3311 Win=8 Len=0"
"1037","8.718951","159","Application Data"
"1038","8.730391","115","Application Data"
"1039","8.746884","115","Application Data"
"1040","8.748556","74","443  >  56494 [ACK] Seq=43784 Ack=3393 Win=8 Len=0"
"1041","8.763574","115","Application Data"
"1042","8.763850","202","Application Data"
"1043","8.763918","74","56494  >  443 [ACK] Seq=3516 Ack=43912 Win=515 Len=0"
"1044","8.766803","363","Application Data"
